20ba419c-b895-4012-b10d-f07322c3066f,,"Yeah that's |receiver.casualName|, comes in all the time",,,,16:51 24/04/2024
4c6b2e35-2852-4356-b5c5-aaa5a132ac22,,"That's |receiver.firstName|, one of our regulars. I always see them with a |receiver.favitem1|",,,,16:51 24/04/2024
f60c3223-2a40-4efa-81ed-6877962f74ad,,"Sure, that's |receiver.firstName|. In here a lot",,,,16:51 24/04/2024
66704edd-6c60-4b6f-a753-5adcbf330a57,,"Yeah, that's one of our regulars. They've always got a |receiver.favitem1|",,,,10:25 18/01/2026
eb11d7d3-60af-4514-8ba9-63a93df297d9,,"Yeah, they're one of the usual faces",,,,10:25 18/01/2026
68c81197-db41-4ff5-a94b-483279cf9244,,"Sure, I've seen them in here plenty",,,,10:26 18/01/2026